{
  "source_label": "Synthetic SYN snapshot fixture",
  "catalog_mode": "complete",
  "types": [
    {
      "ref": "syn://type/information-object",
      "name": "Information object",
      "parents": [],
      "definition": "An information object in this example catalog.",
      "properties": [],
      "metadata_json": "{}"
    },
    {
      "ref": "syn://type/example-document",
      "name": "Example document",
      "parents": ["syn://type/information-object"],
      "definition": "A document represented by a public SYN record.",
      "properties": [
        {
          "name": "related_document",
          "type_ref": "syn://type/example-document",
          "minimum": 0,
          "maximum": 5
        }
      ],
      "metadata_json": "{\"origin\":\"synthetic fixture\",\"confidence\":0.7500}"
    }
  ],
  "objects": [
    {
      "ref": "syn://thing/readme",
      "type_ref": "syn://type/example-document",
      "payload_json": "{\"id\":\"syn://thing/readme\",\"typeRef\":\"syn://type/example-document\",\"name\":\"README\",\"text\":\"Example public document\",\"score\":0.123456789012345678901234567890,\"counter\":123456789012345678901234567890}"
    }
  ],
  "schema_version": 1
}
