{"catalog_mode":"extend_builtin","objects":[{"payload_json":"{\"handlerRef\":\"potbot.cogs.builtin.text_to_json\",\"id\":\"syn://cog/potbot-completion-json-v1\",\"implementationBindingHash\":\"6a524fa6897a2d64a93694483a3fa9d4bfab997372ec3e363ba13d55e49c214f\",\"implementationRevision\":1,\"inputTypeRef\":\"syn://type/potbot-provider-completion-text\",\"name\":\"potbot-completion-json-v1\",\"outputTypeRef\":\"synny://type/potbot-data-document-json\",\"requiresControllerScope\":false,\"schemaVersion\":1,\"typeRef\":\"syn://type/potbot-parse-completion-json-cog\"}","ref":"syn://cog/potbot-completion-json-v1","type_ref":"syn://type/potbot-parse-completion-json-cog"},{"payload_json":"{\"handlerRef\":\"potbot.cogs.builtin.json_to_coding\",\"id\":\"syn://cog/potbot-json-model-coding-v1\",\"implementationBindingHash\":\"c3af34127b86d2af90cb6bea74a11cffa663568124be25a39fb62dbe9f1475c5\",\"implementationRevision\":1,\"inputTypeRef\":\"synny://type/potbot-data-document-json\",\"name\":\"potbot-json-model-coding-v1\",\"outputTypeRef\":\"syn://type/potbot-model-coding-response\",\"requiresControllerScope\":false,\"schemaVersion\":1,\"typeRef\":\"syn://type/potbot-parse-model-coding-cog\"}","ref":"syn://cog/potbot-json-model-coding-v1","type_ref":"syn://type/potbot-parse-model-coding-cog"},{"payload_json":"{\"handlerRef\":\"potbot.cogs.builtin.json_to_action\",\"id\":\"syn://cog/potbot-json-model-action-v1\",\"implementationBindingHash\":\"50616fd9177a40ac0344c9f23c51d9676a315de742847b66f9695a34b84b25c7\",\"implementationRevision\":1,\"inputTypeRef\":\"synny://type/potbot-data-document-json\",\"name\":\"potbot-json-model-action-v1\",\"outputTypeRef\":\"syn://type/potbot-model-action-frame\",\"requiresControllerScope\":false,\"schemaVersion\":1,\"typeRef\":\"syn://type/potbot-parse-model-action-cog\"}","ref":"syn://cog/potbot-json-model-action-v1","type_ref":"syn://type/potbot-parse-model-action-cog"},{"payload_json":"{\"handlerRef\":\"potbot.cogs.builtin.coding_scope_check\",\"id\":\"syn://cog/potbot-scope-check-coding-v1\",\"implementationBindingHash\":\"5e1837339ad2e78bf3756326288dc205077e8b367f2e3f8f293160a538195ab3\",\"implementationRevision\":1,\"inputTypeRef\":\"syn://type/potbot-model-coding-response\",\"name\":\"potbot-scope-check-coding-v1\",\"outputTypeRef\":\"syn://type/potbot-scope-checked-coding-response\",\"requiresControllerScope\":true,\"schemaVersion\":1,\"typeRef\":\"syn://type/potbot-scope-check-model-coding-cog\"}","ref":"syn://cog/potbot-scope-check-coding-v1","type_ref":"syn://type/potbot-scope-check-model-coding-cog"}],"schema_version":1,"source_label":"potbot-cog-data-transformations-v1","types":[{"definition":"Cog that transforms exactly one declared input data Type into one declared output data Type.","metadata_json":"{\"module\":\"potbot.cogs\",\"ontologyVersion\":1}","name":"Potbot transform Cog","parents":["syn://type/cog"],"properties":[{"maximum":1,"minimum":1,"name":"inputTypeRef","type_ref":"syn://type/type"},{"maximum":1,"minimum":1,"name":"outputTypeRef","type_ref":"syn://type/type"},{"maximum":1,"minimum":1,"name":"implementationBindingHash","type_ref":"synny://type/potbot-data-value-string"}],"ref":"syn://type/potbot-transform-cog"},{"definition":"Strict, bounded JSON syntax conversion; never grants execution authority.","metadata_json":"{\"module\":\"potbot.cogs\",\"ontologyVersion\":1}","name":"Parse model completion as JSON","parents":["syn://type/potbot-transform-cog"],"properties":[],"ref":"syn://type/potbot-parse-completion-json-cog"},{"definition":"Checks a JSON document against the coding result contract; output is untrusted.","metadata_json":"{\"module\":\"potbot.cogs\",\"ontologyVersion\":1}","name":"Decode model coding response","parents":["syn://type/potbot-transform-cog"],"properties":[],"ref":"syn://type/potbot-parse-model-coding-cog"},{"definition":"Checks a JSON document against the action frame contract; output is untrusted.","metadata_json":"{\"module\":\"potbot.cogs\",\"ontologyVersion\":1}","name":"Decode model action proposal","parents":["syn://type/potbot-transform-cog"],"properties":[],"ref":"syn://type/potbot-parse-model-action-cog"},{"definition":"Uses separately supplied controller authority; does not settle usage or persist a patch.","metadata_json":"{\"module\":\"potbot.cogs\",\"ontologyVersion\":1}","name":"Scope-check a model coding response","parents":["syn://type/potbot-transform-cog"],"properties":[],"ref":"syn://type/potbot-scope-check-model-coding-cog"},{"definition":"A completed, retained provider text result; completion status must be checked by the caller.","metadata_json":"{\"module\":\"potbot.cogs\",\"ontologyVersion\":1}","name":"Completed provider text","parents":["synny://type/potbot-data-text"],"properties":[],"ref":"syn://type/potbot-provider-completion-text"},{"definition":"A schema-checked model coding response, not an admitted executable patch.","metadata_json":"{\"module\":\"potbot.cogs\",\"ontologyVersion\":1}","name":"Structured model coding response","parents":["synny://type/potbot-data-record"],"properties":[],"ref":"syn://type/potbot-model-coding-response"},{"definition":"A schema-checked action proposal frame, not a dispatched tool action.","metadata_json":"{\"module\":\"potbot.cogs\",\"ontologyVersion\":1}","name":"Structured model action proposal","parents":["synny://type/potbot-data-record"],"properties":[],"ref":"syn://type/potbot-model-action-frame"},{"definition":"Matches controller-supplied coding handoff scope; additional durable and budget checks required.","metadata_json":"{\"module\":\"potbot.cogs\",\"ontologyVersion\":1}","name":"Scope-checked model coding response","parents":["syn://type/potbot-model-coding-response"],"properties":[],"ref":"syn://type/potbot-scope-checked-coding-response"}]}
